{
  "project_name": "climate_model_weaknesses",
  "phase": "complete",
  "created_at": "2026-02-11T08:27:16Z",
  "updated_at": "2026-02-11T08:27:16Z",
  "run_count": 0,
  "plan_file": "plan.json",
  "narration_file": "narration_script.py",
  "voice_config_file": "voice_config.py",
  "scenes": [
    {
      "id": "scene_01_reynolds_overview",
      "title": "Reynolds Foundations",
      "narration_key": "reynolds_overview",
      "narration_summary": "Introduce Reynolds number as the key to fluid dynamics, but pivot to how climate models struggle with its implications across scales—setting up the critique of current modeling approaches.",
      "estimated_words": 150,
      "estimated_duration": "60s",
      "status": "rendered",
      "video_file": "media/videos/scene_01_reynolds_overview/1440p60/Scene01ReynoldsOverview.mp4",
      "complexity": "low",
      "risk_flags": []
    },
    {
      "id": "scene_02_predictability_weakness",
      "title": "Predictability Breakdown",
      "narration_key": "predictability_weakness",
      "narration_summary": "Show how climate models' predictability weakens non-uniformly with Re, exposing their inability to handle transitional regimes where intermittency creates forecast cliffs—revealing a core weakness in spatial-temporal resolution.",
      "estimated_words": 180,
      "estimated_duration": "72s",
      "status": "rendered",
      "video_file": "media/videos/scene_02_predictability_weakness/1440p60/Scene02PredictabilityWeakness.mp4",
      "complexity": "medium",
      "risk_flags": ["Visualization of non-exponential error growth"]
    },
    {
      "id": "scene_03_viscosity_weakness",
      "title": "Viscosity Paradox Exposed",
      "narration_key": "viscosity_weakness",
      "narration_summary": "Reveal the paradox: climate models require viscosity amplification that far exceeds physical justification, masking weaknesses in representing turbulent energy cascades and spatially coherent forcing.",
      "estimated_words": 140,
      "estimated_duration": "56s",
      "status": "rendered",
      "video_file": "media/videos/scene_03_viscosity_weakness/1440p60/Scene03ViscosityWeakness.mp4",
      "complexity": "low",
      "risk_flags": []
    },
    {
      "id": "scene_04_ghost_scale_weakness",
      "title": "Ghost Scale Weakness Diagnostic",
      "narration_key": "ghost_scale_weakness",
      "narration_summary": "Derive the ghost scale as a direct measure of model weakness: when L_implied exceeds domain size, it proves the model artificially suppresses processes it can't represent—exposing gaps in physics coverage at continental to planetary scales.",
      "estimated_words": 200,
      "estimated_duration": "80s",
      "status": "rendered",
      "video_file": "media/videos/scene_04_ghost_scale_weakness/1440p60/Scene04GhostScaleWeakness.mp4",
      "complexity": "high",
      "risk_flags": ["Equation rendering accuracy", "Scale visualization clarity"]
    },
    {
      "id": "scene_05_weakness_implications",
      "title": "Implications for Model Reform",
      "narration_key": "weakness_implications",
      "narration_summary": "Demonstrate how this weakness can be quantified and addressed: compare viscosity in standard vs. extended models to test proposed fixes (e.g., ionospheric coupling), transforming climate modeling from empirical tuning to evidence-based diagnostics.",
      "estimated_words": 230,
      "estimated_duration": "92s",
      "status": "rendered",
      "video_file": "media/videos/scene_05_weakness_implications/1440p60/Scene05WeaknessImplications.mp4",
      "complexity": "medium",
      "risk_flags": ["Data visualization for model comparisons"]
    }
  ],
  "current_scene_index": 5,
  "errors": [
    "Final render failed: ELEVENLABS_API_KEY not set, rendering aborted. Scenes not rendered, ffmpeg concat failed due to missing video files."
  ],
  "history": [
    "2026-02-11: Project initialized",
    "2026-02-11: Plan generated and reviewed",
    "2026-02-11: Narration and voice config created",
    "2026-02-11: Scene files built",
    "2026-02-11: Render attempted but failed due to missing ELEVENLABS_API_KEY"
  ],
  "flags": {
    "needs_human_review": true,
    "dry_run": false,
    "force_replan": false
  }
}
