{
  "project_name": "example-abc",
  "phase": "error",
  "created_at": "2026-02-13T04:27:42Z",
  "updated_at": "2026-02-13T04:37:56Z",
  "run_count": 4,
  "plan_file": "plan.json",
  "narration_file": "narration_script.py",
  "voice_config_file": "voice_config.py",
  "scenes": [
    {
      "id": "scene_01_intro",
      "title": "Introduction",
      "narration_key": "intro",
      "narration_summary": "Hook and brief introduction to hash functions",
      "estimated_words": 50,
      "estimated_duration": "20s",
      "animations": [
        "Write title",
        "Fade in icon"
      ],
      "complexity": "low",
      "risk_flags": [],
      "status": "rendered",
      "file": "scene_01_intro.py",
      "class_name": "Scene01Intro",
      "video_file": "media/videos/scene_01_intro/1440p60/Scene01Intro.mp4",
      "verification": {
        "file_size_bytes": 542230,
        "duration_seconds": 13.083333,
        "audio_present": true,
        "verified_at": "2026-02-13T04:37:07Z"
      }
    },
    {
      "id": "scene_02_definition",
      "title": "What is a Hash Function?",
      "narration_key": "definition",
      "narration_summary": "Core definition and basic explanation",
      "estimated_words": 75,
      "estimated_duration": "30s",
      "animations": [
        "Show input-output diagram",
        "Highlight key terms"
      ],
      "complexity": "low",
      "risk_flags": [],
      "status": "rendered",
      "file": "scene_02_definition.py",
      "class_name": "Scene02Definition",
      "video_file": "media/videos/scene_02_definition/1440p60/Scene02Definition.mp4",
      "verification": {
        "file_size_bytes": 660441,
        "duration_seconds": 16.064,
        "audio_present": true,
        "verified_at": "2026-02-13T04:37:08Z"
      }
    },
    {
      "id": "scene_03_properties",
      "title": "Key Properties",
      "narration_key": "properties",
      "narration_summary": "Important characteristics of hash functions",
      "estimated_words": 75,
      "estimated_duration": "30s",
      "animations": [
        "List properties",
        "Visualize determinism"
      ],
      "complexity": "low",
      "risk_flags": [],
      "status": "rendered",
      "file": "scene_03_properties.py",
      "class_name": "Scene03Properties",
      "video_file": "media/videos/scene_03_properties/1440p60/Scene03Properties.mp4",
      "verification": {
        "file_size_bytes": 921529,
        "duration_seconds": 19.264,
        "audio_present": true,
        "verified_at": "2026-02-13T04:37:08Z"
      }
    },
    {
      "id": "scene_04_examples",
      "title": "Real-World Examples",
      "narration_key": "examples",
      "narration_summary": "Applications in password storage and data integrity",
      "estimated_words": 75,
      "estimated_duration": "30s",
      "animations": [
        "Show password hashing",
        "Demonstrate file integrity"
      ],
      "complexity": "low",
      "risk_flags": [],
      "status": "rendered",
      "file": "scene_04_examples.py",
      "class_name": "Scene04Examples",
      "video_file": "media/videos/scene_04_examples/1440p60/Scene04Examples.mp4",
      "verification": {
        "file_size_bytes": 793895,
        "duration_seconds": 23.3,
        "audio_present": true,
        "verified_at": "2026-02-13T04:37:25Z"
      }
    },
    {
      "id": "scene_05_conclusion",
      "title": "Conclusion and Recap",
      "narration_key": "conclusion",
      "narration_summary": "Summarize key points and importance",
      "estimated_words": 25,
      "estimated_duration": "10s",
      "animations": [
        "Fade out elements",
        "Show final summary"
      ],
      "complexity": "low",
      "risk_flags": [],
      "status": "rendered",
      "file": "scene_05_conclusion.py",
      "class_name": "Scene05Conclusion",
      "video_file": "media/videos/scene_05_conclusion/1440p60/Scene05Conclusion.mp4",
      "verification": {
        "file_size_bytes": 815230,
        "duration_seconds": 12.916667,
        "audio_present": true,
        "verified_at": "2026-02-13T04:37:39Z"
      }
    }
  ],
  "current_scene_index": 5,
  "errors": [
    "Final video failed quality control - check audio/video sync"
  ],
  "history": [
    {
      "phase": "plan",
      "action": "completed",
      "reason": "Generated plan.json with 5 scenes",
      "timestamp": "2026-02-13T04:34:26Z"
    },
    "Phase final_render: Rendered and verified all scenes (scripted), advancing to assemble",
    "Phase assemble: Assembled final_video.mp4 (scripted)"
  ],
  "flags": {
    "needs_human_review": true,
    "dry_run": false,
    "force_replan": false
  },
  "topic": "Example topic: Explain what a hash function is"
}