{
  "project_name": "semi-prime-factorization",
  "topic": "Create a video about semi prime factorization.",
  "phase": "complete",
  "created_at": "2026-02-13T04:53:49Z",
  "updated_at": "2026-02-13T05:08:07Z",
  "run_count": 10,
  "plan_file": "plan.json",
  "narration_file": "narration_script.py",
  "voice_config_file": "voice_config.py",
  "scenes": [
    {
      "id": "scene_01_intro",
      "title": "Introduction to Semi-Primes",
      "narration_key": "intro",
      "narration_summary": "Define what semi-prime numbers are and their relationship to prime numbers.",
      "estimated_words": 100,
      "estimated_duration": "40s",
      "animations": [
        "Write title",
        "Show examples of primes and semi-primes",
        "Fade in definition"
      ],
      "complexity": "low",
      "risk_flags": [],
      "status": "rendered",
      "file": "scene_01_intro.py",
      "class_name": "Scene01Intro",
      "video_file": "media/videos/scene_01_intro/1440p60/Scene01Intro.mp4",
      "verification": {
        "file_size_bytes": 1337263,
        "duration_seconds": 33.616667,
        "audio_present": true,
        "verified_at": "2026-02-13T05:06:01Z"
      }
    },
    {
      "id": "scene_02_properties",
      "title": "Properties of Semi-Primes",
      "narration_key": "properties",
      "narration_summary": "Discuss key properties and characteristics of semi-prime numbers.",
      "estimated_words": 120,
      "estimated_duration": "48s",
      "animations": [
        "List properties with bullets",
        "Animate factor pairs",
        "Show mathematical formulas"
      ],
      "complexity": "low",
      "risk_flags": [],
      "status": "rendered",
      "file": "scene_02_properties.py",
      "class_name": "Scene02Properties",
      "video_file": "media/videos/scene_02_properties/1440p60/Scene02Properties.mp4",
      "verification": {
        "file_size_bytes": 1574040,
        "duration_seconds": 35.333333,
        "audio_present": true,
        "verified_at": "2026-02-13T05:06:01Z"
      }
    },
    {
      "id": "scene_03_identification",
      "title": "Identifying Semi-Primes",
      "narration_key": "identification",
      "narration_summary": "Explain methods to check if a number is semi-prime, including trial division.",
      "estimated_words": 130,
      "estimated_duration": "52s",
      "animations": [
        "Step-by-step algorithm visualization",
        "Factor tree examples",
        "Highlight prime factors"
      ],
      "complexity": "medium",
      "risk_flags": [
        "Requires careful timing for step-by-step animations"
      ],
      "status": "rendered",
      "file": "scene_03_identification.py",
      "class_name": "Scene03Identification",
      "video_file": "media/videos/scene_03_identification/1440p60/Scene03Identification.mp4",
      "verification": {
        "file_size_bytes": 1740140,
        "duration_seconds": 42.474667,
        "audio_present": true,
        "verified_at": "2026-02-13T05:06:01Z"
      }
    },
    {
      "id": "scene_04_factorization",
      "title": "Factorization Techniques",
      "narration_key": "factorization",
      "narration_summary": "Demonstrate factorization methods specific to semi-primes.",
      "estimated_words": 140,
      "estimated_duration": "56s",
      "animations": [
        "Show factorization process",
        "Animate division steps",
        "Display factor pairs"
      ],
      "complexity": "medium",
      "risk_flags": [
        "Potential for complex MathTex equations"
      ],
      "status": "rendered",
      "file": "scene_04_factorization.py",
      "class_name": "Scene04Factorization",
      "video_file": "media/videos/scene_04_factorization/1440p60/Scene04Factorization.mp4",
      "verification": {
        "file_size_bytes": 1853613,
        "duration_seconds": 44.25,
        "audio_present": true,
        "verified_at": "2026-02-13T05:06:35Z"
      }
    },
    {
      "id": "scene_05_conclusion",
      "title": "Summary and Recap",
      "narration_key": "conclusion",
      "narration_summary": "Summarize key concepts and re-state the importance of semi-prime factorization.",
      "estimated_words": 110,
      "estimated_duration": "44s",
      "animations": [
        "Recap key points",
        "Final visual summary",
        "Fade out"
      ],
      "complexity": "low",
      "risk_flags": [],
      "status": "rendered",
      "file": "scene_05_conclusion.py",
      "class_name": "Scene05Conclusion",
      "video_file": "media/videos/scene_05_conclusion/1440p60/Scene05Conclusion.mp4",
      "verification": {
        "file_size_bytes": 1890501,
        "duration_seconds": 43.283333,
        "audio_present": true,
        "verified_at": "2026-02-13T05:07:22Z"
      }
    }
  ],
  "current_scene_index": 5,
  "errors": [],
  "history": [
    {
      "timestamp": "2026-02-13T05:00:00Z",
      "phase": "plan",
      "action": "Generated plan.json with 5 scenes covering introduction, properties, identification, factorization, and conclusion for semi-prime factorization topic. Estimated total duration 4 minutes, 600 words."
    },
    {
      "timestamp": "2026-02-13T05:01:00Z",
      "phase": "review",
      "action": "Reviewed plan for technical feasibility. Narrative flow is logical, animations are Manim-compatible (no 3D, no custom mobjects), timing estimates allow for narration+animation. Medium complexity scenes flagged but not critical. Approved plan."
    },
    {
      "timestamp": "2026-02-13T05:02:00Z",
      "phase": "narration",
      "action": "Generated narration_script.py with conversational scripts for all 5 scenes (approximately 600 words total) and voice_config.py with ElevenLabs settings using Big D's cloned voice."
    },
    {
      "timestamp": "2026-02-13T05:03:00Z",
      "phase": "build_scenes",
      "action": "Built scene_01_intro.py with Manim VoiceoverScene animations for introduction to semi-primes including title, subtitle, and mathematical examples."
    },
    {
      "timestamp": "2026-02-13T05:04:00Z",
      "phase": "build_scenes",
      "action": "Completed building all 5 scene files: scene_01_intro.py, scene_02_properties.py, scene_03_identification.py, scene_04_factorization.py, scene_05_conclusion.py with VoiceoverScene animations synchronized to ElevenLabs narration. Advanced to final_render phase."
    },
    {
      "timestamp": "2026-02-13T05:05:00Z",
      "phase": "build_scenes",
      "action": "All scenes built successfully. Advancing to final_render phase."
    },
    {
      "timestamp": "2026-02-13T05:03:37Z",
      "phase": "repair",
      "action": "Backfilled scene file/class_name metadata: set file for scene_01_intro -> scene_01_intro.py; set class_name for scene_01_intro -> Scene01Intro; set file for scene_02_properties -> scene_02_properties.py; set class_name for scene_02_properties -> Scene02Properties; set file for scene_03_identification -> scene_03_identification.py; set class_name for scene_03_identification -> Scene03Identification; set file for scene_04_factorization -> scene_04_factorization.py; set class_name for scene_04_factorization -> Scene04Factorization; set file for scene_05_conclusion -> scene_05_conclusion.py; set class_name for scene_05_conclusion -> Scene05Conclusion"
    },
    "Phase final_render: Rendered and verified all scenes (scripted), advancing to assemble",
    "Phase assemble: Assembled final_video.mp4 (scripted)"
  ],
  "flags": {
    "needs_human_review": false,
    "dry_run": false,
    "force_replan": false
  }
}