{
  "project_name": "types-of-infinity",
  "topic": "Create a video describing the different types of mathematical infinity",
  "phase": "final_render",
  "created_at": "2026-02-13T23:15:13Z",
  "updated_at": "2026-02-13T23:17:38Z",
  "run_count": 7,
  "plan_file": "plan.json",
  "narration_file": "narration_script.py",
  "voice_config_file": null,
  "scenes": [
    {
      "id": "scene_01_intro",
      "title": "Introduction to Infinity",
      "narration_key": "intro",
      "narration_summary": "Hook with the intuitive idea of infinity and its philosophical roots",
      "estimated_words": 75,
      "estimated_duration": "30s",
      "animations": [
        "Write title",
        "Show infinite symbols",
        "FadeIn introductory graphic"
      ],
      "complexity": "low",
      "risk_flags": [],
      "status": "built",
      "file": "scene_01_intro.py",
      "class_name": "Scene01Intro"
    },
    {
      "id": "scene_02_countable_infinity",
      "title": "Countable Infinity",
      "narration_key": "countable",
      "narration_summary": "Explain countable sets using natural numbers as an example",
      "estimated_words": 80,
      "estimated_duration": "32s",
      "animations": [
        "Display natural number set",
        "Animate counting",
        "Show bijection concept"
      ],
      "complexity": "medium",
      "risk_flags": [
        "Requires careful animation timing for set visualization"
      ],
      "status": "built",
      "file": "scene_02_countable_infinity.py",
      "class_name": "Scene02CountableInfinity"
    },
    {
      "id": "scene_03_uncountable_infinity",
      "title": "Uncountable Infinity",
      "narration_key": "uncountable",
      "narration_summary": "Introduce uncountable sets with real numbers and diagonalization",
      "estimated_words": 85,
      "estimated_duration": "34s",
      "animations": [
        "Show real number line",
        "Demonstrate Cantor's diagonal argument",
        "Visualize continuum"
      ],
      "complexity": "high",
      "risk_flags": [
        "Diagonalization animation may be complex to implement clearly"
      ],
      "status": "built",
      "file": "scene_03_uncountable_infinity.py",
      "class_name": "Scene03UncountableInfinity"
    },
    {
      "id": "scene_04_cardinal_numbers",
      "title": "Cardinal Numbers",
      "narration_key": "cardinals",
      "narration_summary": "Discuss cardinal infinities like aleph-0, aleph-1, and the continuum hypothesis",
      "estimated_words": 90,
      "estimated_duration": "36s",
      "animations": [
        "Display aleph symbols",
        "Compare set sizes",
        "Show cardinal arithmetic"
      ],
      "complexity": "medium",
      "risk_flags": [],
      "status": "built",
      "file": "scene_04_cardinal_numbers.py",
      "class_name": "Scene04CardinalNumbers"
    },
    {
      "id": "scene_05_ordinal_infinities",
      "title": "Ordinal Infinities",
      "narration_key": "ordinals",
      "narration_summary": "Explain ordinal numbers and well-ordering beyond cardinals",
      "estimated_words": 70,
      "estimated_duration": "28s",
      "animations": [
        "Show ordinal sequences",
        "Animate ordering concepts",
        "Display omega symbol"
      ],
      "complexity": "medium",
      "risk_flags": [
        "Abstract concepts may be hard to visualize"
      ],
      "status": "built",
      "file": "scene_05_ordinal_infinities.py",
      "class_name": "Scene05OrdinalInfinities"
    },
    {
      "id": "scene_06_paradoxes",
      "title": "Paradoxes and Applications",
      "narration_key": "paradoxes",
      "narration_summary": "Cover Hilbert's hotel and real-world applications of infinity",
      "estimated_words": 85,
      "estimated_duration": "34s",
      "animations": [
        "Animate Hilbert's hotel paradox",
        "Show geometric series",
        "Display applications"
      ],
      "complexity": "low",
      "risk_flags": [],
      "status": "built",
      "file": "scene_06_paradoxes.py",
      "class_name": "Scene06Paradoxes"
    },
    {
      "id": "scene_07_conclusion",
      "title": "Conclusion and Recap",
      "narration_key": "conclusion",
      "narration_summary": "Summarize key types of infinity and their significance",
      "estimated_words": 75,
      "estimated_duration": "30s",
      "animations": [
        "FadeIn summary points",
        "Show final visualization",
        "End with infinity symbol"
      ],
      "complexity": "low",
      "risk_flags": [],
      "status": "built",
      "file": "scene_07_conclusion.py",
      "class_name": "Scene07Conclusion"
    }
  ],
  "current_scene_index": 7,
  "errors": [],
  "history": [
    {
      "timestamp": "2026-02-13T23:15:26Z",
      "phase": "plan",
      "action": "Applied plan.json to project_state.json (deterministic)"
    },
    {
      "timestamp": "2026-02-13T23:15:26Z",
      "phase": "plan",
      "action": "Applied plan.json to project_state.json (deterministic)"
    },
    {
      "timestamp": "2026-02-13T23:15:26Z",
      "phase": "review",
      "action": "Advanced to narration (deterministic)"
    },
    {
      "timestamp": "2026-02-13T23:15:27Z",
      "phase": "review",
      "action": "Advanced to narration (deterministic)"
    },
    {
      "timestamp": "2026-02-13T23:15:39Z",
      "phase": "narration",
      "action": "Detected narration_script.py; advanced to build_scenes (deterministic)"
    },
    {
      "timestamp": "2026-02-13T23:20:00Z",
      "phase": "build_scenes",
      "action": "Built scene_01_intro.py with Scene01Intro class (deterministic)"
    },
    {
      "timestamp": "2026-02-13T23:16:04Z",
      "phase": "build_scenes",
      "action": "Marked built: scene_02_countable_infinity.py (Scene02CountableInfinity); advanced index to 2"
    },
    {
      "timestamp": "2026-02-13T23:16:04Z",
      "phase": "build_scenes",
      "action": "Marked built: scene_03_uncountable_infinity.py (Scene03UncountableInfinity); advanced index to 3"
    },
    {
      "timestamp": "2026-02-13T23:16:41Z",
      "phase": "build_scenes",
      "action": "Marked built: scene_04_cardinal_numbers.py (Scene04CardinalNumbers); advanced index to 4"
    },
    {
      "timestamp": "2026-02-13T23:16:41Z",
      "phase": "build_scenes",
      "action": "Marked built: scene_05_ordinal_infinities.py (Scene05OrdinalInfinities); advanced index to 5"
    },
    {
      "timestamp": "2026-02-13T23:17:38Z",
      "phase": "build_scenes",
      "action": "Marked built: scene_07_conclusion.py (Scene07Conclusion); advanced index to 7"
    }
  ],
  "flags": {
    "needs_human_review": false,
    "dry_run": false,
    "force_replan": false
  }
}